{
  "case_id": "CASE-C10-L8",
  "context_version": "0.2.0",
  "deadline_bindings": [],
  "deadline_requests": [],
  "evidence_requests": [
    {
      "basis_refs": [
        "se:src:family-visa-istanbul"
      ],
      "kind": "proof_restriction_review",
      "request_id": "evidence:c10:restriction",
      "scope": "fictional individualized document exclusivity review"
    }
  ],
  "route_requests": [],
  "temporal_events": []
}
